{
  "$schema": "../../../packages/evaluators/schemas/blueprint-test-case.schema.json",
  "format": "gik-blueprint-test/1",
  "name": "incident explorer 2 authored semantic composition",
  "blueprintId": "incident-report-explorer-2",
  "assertions": [
    { "kind": "valid-artifact" },
    { "kind": "composition-valid" },
    {
      "kind": "equals",
      "pointer": "/payload/runtime/externals/projectionViews/semantic/use",
      "value": ["narrative"]
    }
  ],
  "materializations": [
    {
      "name": "operational",
      "externalContext": { "attention": "operational" },
      "assertions": [
        {
          "kind": "placement-children",
          "parent": "analysis-layout",
          "value": ["analysis-runner", "analysis-as-on", "report-presentation"]
        }
      ]
    },
    {
      "name": "brief",
      "externalContext": { "attention": "brief" },
      "assertions": [
        {
          "kind": "placement-children",
          "parent": "analysis-layout",
          "value": ["analysis-runner", "analysis-as-on", "report-presentation"]
        }
      ]
    },
    {
      "name": "hosted analysis",
      "externalContext": { "hostedAnalysis": true },
      "assertions": [
        {
          "kind": "placement-children",
          "parent": "analysis-layout",
          "value": ["analysis-runner", "analysis-as-on", "report-presentation"]
        }
      ]
    }
  ]
}