{
  "$schema": "../../schemas/blueprint-test-case.schema.json",
  "format": "gik-blueprint-test/1",
  "name": "incident explorer 2 authored semantic composition",
  "blueprintId": "incident-report-explorer-2",
  "assertions": [
    { "kind": "valid-artifact" },
    { "kind": "composition-valid" },
    {
      "kind": "equals",
      "pointer": "/payload/runtime/externals/projectionViews/semantic/use",
      "value": ["event-series", "process", "entity-set", "decision", "work-set"]
    }
  ],
  "materializations": [
    {
      "name": "operational",
      "externalContext": { "attention": "operational" },
      "assertions": [
        {
          "kind": "placement-children",
          "parent": "incident-semantic-analyzer",
          "value": ["incident-verdict", "incident-attack-path", "incident-blast-radius", "incident-timeline", "incident-techniques", "incident-response", "incident-notes"]
        }
      ]
    },
    {
      "name": "brief",
      "externalContext": { "attention": "brief" },
      "assertions": [
        {
          "kind": "placement-children",
          "parent": "incident-semantic-analyzer",
          "value": ["incident-verdict", "incident-attack-path", "incident-response", "incident-notes"]
        }
      ]
    },
    {
      "name": "hosted analysis",
      "externalContext": { "hostedAnalysis": true },
      "assertions": [
        {
          "kind": "placement-children",
          "parent": "incident-semantic-analyzer",
          "value": ["incident-verdict", "incident-attack-path", "incident-blast-radius", "incident-timeline", "incident-techniques", "incident-response", "incident-notes"]
        }
      ]
    }
  ]
}