{
  "$schema": "../../../packages/evaluators/schemas/blueprint-test-case.schema.json",
  "format": "gik-blueprint-test/1",
  "name": "incident explorer 3 source-faithful composition",
  "blueprintId": "incident-report-explorer-3",
  "assertions": [
    { "kind": "valid-artifact" },
    { "kind": "composition-valid" }
  ],
  "materializations": [
    {
      "name": "hosted analysis",
      "externalContext": { "hostedAnalysis": true, "content": "# Hosted incident" },
      "assertions": []
    }
  ]
}